{
  "$schema": "https://raw.githubusercontent.com/dollarlint/dollarlint/main/schemas/dollarlint-result.schema.json",
  "formatVersion": 1,
  "root": "/var/folders/dg/0y8q_bz169jbjnv14dwmw0dc0000gn/T/dollarlint-corpus.2210516822",
  "summary": {
    "discovered": 287,
    "validated": 64,
    "skipped": 219,
    "failed": 4,
    "issues": {
      "total": 8,
      "parsing": 4,
      "validation": 4,
      "schema": 0,
      "coverage": 0
    },
    "ignored": 0,
    "warnings": 0,
    "durationNanos": 9269013417
  },
  "files": [
    {
      "format": "jsonc",
      "ignored": 0,
      "issues": 0,
      "message": "parse /var/folders/dg/0y8q_bz169jbjnv14dwmw0dc0000gn/T/dollarlint-corpus.2210516822/kotlin/.ai/mcp/mcp.json: hujson: line 1, column 1: parsing value: unexpected EOF",
      "path": "kotlin/.ai/mcp/mcp.json",
      "status": "error"
    },
    {
      "format": "json",
      "ignored": 0,
      "issues": 0,
      "path": "kotlin/.claude/settings.json",
      "schema": "https://www.schemastore.org/claude-code-settings.json",
      "schemaSource": "catalog:schemastore:Claude Code Settings",
      "status": "validated"
    },
    {
      "format": "yaml",
      "ignored": 0,
      "issues": 0,
      "path": "kotlin/.space/fleet.devfile.yaml",
      "status": "skipped"
    },
    {
      "format": "yaml",
      "ignored": 0,
      "issues": 0,
      "path": "kotlin/.space/idea.devfile.yaml",
      "status": "skipped"
    },
    {
      "format": "json",
      "ignored": 0,
      "issues": 0,
      "path": "kotlin/.space/safe-merge-coordinator.json",
      "status": "skipped"
    },
    {
      "format": "json",
      "ignored": 0,
      "issues": 0,
      "path": "kotlin/.space/safe-merge.json",
      "status": "skipped"
    },
    {
      "format": "json",
      "ignored": 0,
      "issues": 0,
      "path": "kotlin/compiler/arguments/resources/kotlin-compiler-arguments.json",
      "status": "skipped"
    },
    {
      "format": "json",
      "ignored": 0,
      "issues": 0,
      "path": "kotlin/compiler/incremental-compilation-impl/testData/org/jetbrains/kotlin/incremental/classpathDiff/ClasspathSnapshotterTest/java/testSimpleClass/expected-snapshot/com/example/SimpleClass.json",
      "status": "skipped"
    },
    {
      "format": "json",
      "ignored": 0,
      "issues": 0,
      "path": "kotlin/compiler/incremental-compilation-impl/testData/org/jetbrains/kotlin/incremental/classpathDiff/ClasspathSnapshotterTest/java/testSimpleClass/expected-snapshot-CLASS_LEVEL/com/example/SimpleClass.json",
      "status": "skipped"
    },
    {
      "format": "json",
      "ignored": 0,
      "issues": 0,
      "path": "kotlin/compiler/incremental-compilation-impl/testData/org/jetbrains/kotlin/incremental/classpathDiff/ClasspathSnapshotterTest/kotlin/testSimpleClass/expected-snapshot/com/example/SimpleClass.json",
      "status": "skipped"
    },
    {
      "format": "json",
      "ignored": 0,
      "issues": 0,
      "path": "kotlin/compiler/incremental-compilation-impl/testData/org/jetbrains/kotlin/incremental/classpathDiff/ClasspathSnapshotterTest/kotlin/testSimpleClass/expected-snapshot-CLASS_LEVEL/com/example/SimpleClass.json",
      "status": "skipped"
    },
    {
      "format": "toml",
      "ignored": 0,
      "issues": 0,
      "path": "kotlin/compiler/psi/psi-api/review-rules/parser-testdata-update.toml",
      "status": "skipped"
    },
    {
      "format": "toml",
      "ignored": 0,
      "issues": 0,
      "path": "kotlin/compiler/psi/psi-api/review-rules/stub-version-update.toml",
      "status": "skipped"
    },
    {
      "format": "jsonc",
      "ignored": 0,
      "issues": 0,
      "message": "parse /var/folders/dg/0y8q_bz169jbjnv14dwmw0dc0000gn/T/dollarlint-corpus.2210516822/kotlin/compiler/testData/cli/js/reportPerfJson.perf.json: hujson: line 3, column 18: invalid character '$' at start of value",
      "path": "kotlin/compiler/testData/cli/js/reportPerfJson.perf.json",
      "status": "error"
    },
    {
      "format": "jsonc",
      "ignored": 0,
      "issues": 0,
      "message": "parse /var/folders/dg/0y8q_bz169jbjnv14dwmw0dc0000gn/T/dollarlint-corpus.2210516822/kotlin/compiler/testData/cli/jvm/reportPerfJson.perf.json: hujson: line 3, column 18: invalid character '$' at start of value",
      "path": "kotlin/compiler/testData/cli/jvm/reportPerfJson.perf.json",
      "status": "error"
    },
    {
      "format": "json",
      "ignored": 0,
      "issues": 0,
      "path": "kotlin/compiler/tests-spec/testData/codegen/box/linked/exceptions/catching-exceptions/testsMap.json",
      "status": "skipped"
    },
    {
      "format": "json",
      "ignored": 0,
      "issues": 0,
      "path": "kotlin/compiler/tests-spec/testData/codegen/box/linked/expressions/additive-expression/testsMap.json",
      "status": "skipped"
    },
    {
      "format": "json",
      "ignored": 0,
      "issues": 0,
      "path": "kotlin/compiler/tests-spec/testData/codegen/box/linked/expressions/built-in-types-and-their-semantics/kotlin.nothing-1/testsMap.json",
      "status": "skipped"
    },
    {
      "format": "json",
      "ignored": 0,
      "issues": 0,
      "path": "kotlin/compiler/tests-spec/testData/codegen/box/linked/expressions/built-in-types-and-their-semantics/kotlin.unit/testsMap.json",
      "status": "skipped"
    },
    {
      "format": "json",
      "ignored": 0,
      "issues": 0,
      "path": "kotlin/compiler/tests-spec/testData/codegen/box/linked/expressions/cast-expression/testsMap.json",
      "status": "skipped"
    },
    {
      "format": "json",
      "ignored": 0,
      "issues": 0,
      "path": "kotlin/compiler/tests-spec/testData/codegen/box/linked/expressions/comparison-expressions/testsMap.json",
      "status": "skipped"
    },
    {
      "format": "json",
      "ignored": 0,
      "issues": 0,
      "path": "kotlin/compiler/tests-spec/testData/codegen/box/linked/expressions/conditional-expression/testsMap.json",
      "status": "skipped"
    },
    {
      "format": "json",
      "ignored": 0,
      "issues": 0,
      "path": "kotlin/compiler/tests-spec/testData/codegen/box/linked/expressions/constant-literals/boolean-literals/testsMap.json",
      "status": "skipped"
    },
    {
      "format": "json",
      "ignored": 0,
      "issues": 0,
      "path": "kotlin/compiler/tests-spec/testData/codegen/box/linked/expressions/constant-literals/character-literals/testsMap.json",
      "status": "skipped"
    },
    {
      "format": "json",
      "ignored": 0,
      "issues": 0,
      "path": "kotlin/compiler/tests-spec/testData/codegen/box/linked/expressions/constant-literals/integer-literals/binary-integer-literals/testsMap.json",
      "status": "skipped"
    },
    {
      "format": "json",
      "ignored": 0,
      "issues": 0,
      "path": "kotlin/compiler/tests-spec/testData/codegen/box/linked/expressions/constant-literals/integer-literals/decimal-integer-literals/testsMap.json",
      "status": "skipped"
    },
    {
      "format": "json",
      "ignored": 0,
      "issues": 0,
      "path": "kotlin/compiler/tests-spec/testData/codegen/box/linked/expressions/constant-literals/integer-literals/hexadecimal-integer-literals/testsMap.json",
      "status": "skipped"
    },
    {
      "format": "json",
      "ignored": 0,
      "issues": 0,
      "path": "kotlin/compiler/tests-spec/testData/codegen/box/linked/expressions/constant-literals/real-literals/testsMap.json",
      "status": "skipped"
    },
    {
      "format": "json",
      "ignored": 0,
      "issues": 0,
      "path": "kotlin/compiler/tests-spec/testData/codegen/box/linked/expressions/constant-literals/the-types-for-integer-literals/testsMap.json",
      "status": "skipped"
    },
    {
      "format": "json",
      "ignored": 0,
      "issues": 0,
      "path": "kotlin/compiler/tests-spec/testData/codegen/box/linked/expressions/elvis-operator-expression/testsMap.json",
      "status": "skipped"
    },
    {
      "format": "json",
      "ignored": 0,
      "issues": 0,
      "path": "kotlin/compiler/tests-spec/testData/codegen/box/linked/expressions/equality-expressions/reference-equality-expressions/testsMap.json",
      "status": "skipped"
    },
    {
      "format": "json",
      "ignored": 0,
      "issues": 0,
      "path": "kotlin/compiler/tests-spec/testData/codegen/box/linked/expressions/equality-expressions/value-equality-expressions/testsMap.json",
      "status": "skipped"
    },
    {
      "format": "json",
      "ignored": 0,
      "issues": 0,
      "path": "kotlin/compiler/tests-spec/testData/codegen/box/linked/expressions/indexing-expressions/testsMap.json",
      "status": "skipped"
    },
    {
      "format": "json",
      "ignored": 0,
      "issues": 0,
      "path": "kotlin/compiler/tests-spec/testData/codegen/box/linked/expressions/jump-expressions/break-expression/testsMap.json",
      "status": "skipped"
    },
    {
      "format": "json",
      "ignored": 0,
      "issues": 0,
      "path": "kotlin/compiler/tests-spec/testData/codegen/box/linked/expressions/jump-expressions/continue-expression/testsMap.json",
      "status": "skipped"
    },
    {
      "format": "json",
      "ignored": 0,
      "issues": 0,
      "path": "kotlin/compiler/tests-spec/testData/codegen/box/linked/expressions/jump-expressions/return-expressions/testsMap.json",
      "status": "skipped"
    },
    {
      "format": "json",
      "ignored": 0,
      "issues": 0,
      "path": "kotlin/compiler/tests-spec/testData/codegen/box/linked/expressions/logical-conjunction-expression/testsMap.json",
      "status": "skipped"
    },
    {
      "format": "json",
      "ignored": 0,
      "issues": 0,
      "path": "kotlin/compiler/tests-spec/testData/codegen/box/linked/expressions/logical-disjunction-expression/testsMap.json",
      "status": "skipped"
    },
    {
      "format": "json",
      "ignored": 0,
      "issues": 0,